{
  "sources_used": [
    "market_history"
  ],
  "start": "2015-10-07T00:00:00+00:00",
  "end": "2018-06-06T00:00:00+00:00",
  "bars_count": 696,
  "missingness_report": {},
  "corporate_actions_applied": [],
  "adjustments": [],
  "outliers_detected": {},
  "drop_or_repair_decisions": [],
  "quality_gates": {},
  "data_hashes": {
    "dataset_hash_id": "6ef0906719a7de0c",
    "hash_algorithm": "sha256",
    "hash_count": 11,
    "all_resolvable": true
  }
}